{"schemaVersion":"1.0.0","scope":"art-direction-handoff","artifactSha256":"936d8ca7f71a96e93fb58e8d196c6a8f168536701382a1ab7cd18ad80c1e61f9","reviewedAt":"2026-08-19","role":"company_art_direction_evidence_verifier","totalScore":95,"categoryScores":{"evidence":19,"synthesis":17,"typography":14,"visualLanguage":14,"brandSafety":12,"themeHandoff":12,"uncertainty":7},"categoryFloorsPass":true,"scoreCap":null,"hardBlockers":[],"verdict":"PASS","findings":[{"category":"evidence","evidence":"designs/samsung-sds/research/art-direction/art-direction.json: company, researchCoverage, E01-E14; designs/samsung-sds/research/art-direction/sources.md: S01-S12 and evidence ledger; validator output","deduction":"The exact SHA-256 snapshot validates. The canonical Korean Samsung SDS identity, official corporate/product/careers coverage, dated source roles, and two distinct user-provided rendered official contexts (E13, E14) remain traceable. Current spot checks of the official home and cloud page support the corporate proposition/module structure and cloud operational sequence. One point withheld because the rendered captures are described rather than retained as independently re-inspectable local artifacts."},{"category":"synthesis","evidence":"art-direction.json: visualPrinciples[0-3], company.targetRole, tokens, portfolioTranslation.pageTypeDirections","deduction":"Four principles preserve observed fact -> abstraction -> portfolio decision, are relevant to a server/DevOps portfolio, and avoid interface imitation. One point withheld because the cover and closing directions remain less testable than the architecture/result directions for focal-field and information-density limits."},{"category":"typography","evidence":"art-direction.json: tokens.typography, E10, E12; sources.md: Font and restricted-asset register; https://github.com/IBM/plex/blob/master/LICENSE.txt","deduction":"SamsungOne is correctly recorded as proprietary/restricted and never selected. IBM Plex Sans KR has an OFL-1.1 source, verified Korean-support assertion, static weight set, implementable roles, and declared PDF embedding permission. One point withheld because the actual local static font files, Korean glyph check, and final PDF embedding proof are appropriately deferred to application."},{"category":"visualLanguage","evidence":"art-direction.json: E13-E14, tokens.color/shape/surface/layout/imagery/iconography/tone, portfolioTranslation.themeCandidates","deduction":"The two rendered observations support the documented display hierarchy, calm evidence space, controlled focal field, rounded controls, modular separators, and cool emphasis. All required semantic candidates include value, rationale, confidence, and evidence IDs without claiming sampled Samsung values. One point withheld because color, radius, elevation, and type metrics remain intentionally self-authored rather than measured from official rendered surfaces."},{"category":"brandSafety","evidence":"art-direction.json: E10-E11, offLimits, portfolioTranslation.avoid, compliance; sources.md: Font and restricted-asset register","deduction":"The package explicitly excludes Samsung/Samsung SDS/SCP logos, wordmarks, slogans, screenshots, product UI, diagrams, imagery, icon packs, production CSS, and SamsungOne. It specifies self-authored diagrams and labels rather than trademark-confusing reuse. No deduction."},{"category":"themeHandoff","evidence":"art-direction.json: portfolioTranslation.themeCandidates, pageTypeDirections, use, avoid; portfolio-system/THEME_CONTRACT.md","deduction":"All required theme-contract variables are present with traceable metadata. Cover, architecture, result, and closing guidance remains content-, DOM-, page-order-, and common-core-neutral. This review approves research-handoff readiness only, not a final CSS theme or rendered portfolio."},{"category":"uncertainty","evidence":"art-direction.json: researchCoverage.limitations, uncertainties[0-2]; sources.md: Conflicts, limits and weighting","deduction":"Exact palette, font metrics, image crops, interaction behavior, authenticated SCP console UI, and SamsungOne rights remain explicitly bounded with impacts and resolution paths. One point withheld because the rendered-capture provenance is documented but no durable local capture artifact is available for reinspection."}]}
