{"schemaVersion":"1.0.0","scope":"art-direction-handoff","artifactSha256":"936d8ca7f71a96e93fb58e8d196c6a8f168536701382a1ab7cd18ad80c1e61f9","reviewedAt":"2026-08-19","role":"company_art_direction_fit_verifier","totalScore":95,"categoryScores":{"evidence":19,"synthesis":17,"typography":14,"visualLanguage":13,"brandSafety":12,"themeHandoff":12,"uncertainty":8},"categoryFloorsPass":true,"scoreCap":null,"hardBlockers":[],"verdict":"PASS","findings":[{"category":"evidence","evidence":"art-direction.json: E01–E14; sources.md: S01–S12; validator PASS","deduction":"공식 기업·제품·채용 맥락과 사용자 제공 렌더 화면 2개가 구분돼 있고, 표본 URL을 재확인했다. 기업 홈의 대형 Enterprise AX 선언·모듈/수치 구조와 클라우드 제품 페이지의 번호 진행·운영 정보 구조는 관찰과 일치한다. 다만 렌더 캡처는 소스 자산이 아니라 사용자 제공 관찰 근거이므로, 정확한 색상값·폰트 메트릭 주장을 하지 않은 현재의 한정이 적절하다."},{"category":"synthesis","evidence":"art-direction.json: visualPrinciples[0..3], portfolioTranslation.pageTypeDirections","deduction":"증거→추상 원칙→포트폴리오 결정 사슬이 일관되고, Server/DevOps 지원 맥락에 운영 책임·가용성·개선 루프를 우선시한다. 원칙 중 ‘Contrast frames proof’는 시각적 차별화에는 유효하지만 실제 SDS 화면 스타일의 재현으로 확대 적용하지 않는 현재의 제한을 유지해야 한다."},{"category":"typography","evidence":"art-direction.json: tokens.typography; E10, E12; sources.md: Font and restricted-asset register","deduction":"SamsungOne을 관찰 전용·제한 폰트로 분리했고, IBM Plex Sans KR의 OFL-1.1, 한글 지원, 정적 웨이트와 PDF 임베딩 허용을 후보 계약에 명시했다. 최종 적용 전에는 실제 로컬 정적 파일, 한글/숫자 글리프, PDF 임베딩을 다시 검증해야 하므로 만점은 부여하지 않는다."},{"category":"visualLanguage","evidence":"art-direction.json: tokens.color/shape/surface/layout/imagery/iconography/tone; E13, E14","deduction":"밝은 근거 공간과 하나의 절제된 초점 필드, 큰 선언과 라벨·번호 기반 증거의 대비가 구현 가능한 규칙으로 번역됐다. 색상·반경·그림자 값은 자가 작성 후보이며 다수가 low confidence이므로, 공식 값이나 제품 UI를 모사하는 것으로 표현하거나 사용해서는 안 된다."},{"category":"brandSafety","evidence":"art-direction.json: offLimits, compliance, portfolioTranslation.avoid; E10, E11, E13, E14","deduction":"로고·워드마크·슬로건·스크린샷·공식 다이어그램/아이콘·제작 CSS·SamsungOne을 명시적으로 배제하고, 고객사 로고와 캐러셀을 자가 작성 지표/라벨로 변환하도록 제한했다. 회사와의 제휴 또는 공식 디자인이라는 오인을 유발하는 지시도 없다."},{"category":"themeHandoff","evidence":"portfolio-system/THEME_CONTRACT.md; art-direction.json: portfolioTranslation.themeCandidates, pageTypeDirections, compliance","deduction":"필수 21개 의미 토큰 후보와 cover/architecture/result/closing 지침이 모두 존재하며, 사실·콘텐츠·시맨틱 DOM·페이지 순서·공통 코어 변경 없이 적용할 수 있다. 이 결과는 연구 핸드오프 준비만 승인하며, 테마 CSS 또는 렌더된 포트폴리오의 품질을 승인하지 않는다."},{"category":"uncertainty","evidence":"art-direction.json: researchCoverage.limitations, uncertainties; sources.md: Conflicts, limits and weighting","deduction":"미관찰 콘솔 UI, 정확한 팔레트·폰트 메트릭·상호작용을 분리하고, 영향과 해결 경로를 기록했다. 기업/제품 증거를 우선하고 채용 표면을 역할 서사에만 제한한 결정도 명시적이다."}]}
