{"schemaVersion":"1.0.0","scope":"art-direction-handoff","artifactSha256":"936d8ca7f71a96e93fb58e8d196c6a8f168536701382a1ab7cd18ad80c1e61f9","reviewedAt":"2026-08-19","role":"company_art_direction_evidence_verifier","totalScore":95,"categoryScores":{"evidence":19,"synthesis":17,"typography":14,"visualLanguage":14,"brandSafety":12,"themeHandoff":12,"uncertainty":7},"categoryFloorsPass":true,"scoreCap":null,"hardBlockers":[],"verdict":"PASS","findings":[{"category":"evidence","evidence":"designs/samsung-sds/research/art-direction/art-direction.json: company, researchCoverage, E01-E14; sources.md: S01-S12 and evidence ledger","deduction":"The canonical Korean Samsung SDS identity, current access dates, distinct official corporate/product/careers contexts, and two distinct user-provided rendered official captures are traceable. Official home, cloud, careers, Samsung font, and IBM license sources were spot-checked. One point withheld because the two rendered captures are described rather than retained as inspectable local research artifacts; their visual observations are nevertheless specifically bounded to supplied captures and URLs."},{"category":"synthesis","evidence":"art-direction.json: visualPrinciples[0-3], tokens, portfolioTranslation.pageTypeDirections; art-direction.md: Observation-principle-portfolio decision","deduction":"Four coherent principles maintain observation-to-abstraction-to-portfolio-decision separation and are weighted toward server/DevOps. One point withheld because the cover/closing directions remain comparatively general rather than stating a more testable contrast/density boundary."},{"category":"typography","evidence":"art-direction.json: E10, E12, tokens.typography, portfolioTranslation.themeCandidates.--theme-display-font/--theme-body-font/--theme-mono-font; sources.md: Font and restricted-asset register","deduction":"SamsungOne is correctly observed as proprietary/restricted and never selected. IBM Plex Sans KR is linked to its OFL-1.1 license, identified as Korean-capable, and supplied with static weights. One point withheld because the exact local font binary, Korean glyph test, and final PDF-embedding proof are correctly deferred to application rather than evidenced in this extraction."},{"category":"visualLanguage","evidence":"art-direction.json: E13-E14, tokens.color/shape/surface/layout/imagery/iconography/tone, portfolioTranslation.themeCandidates","deduction":"The rendered evidence supports the documented large-display, calm-evidence-space, focal-field, rounded-control, separator, and blue/cool emphasis tendencies. Semantic candidates include rationale, confidence, and evidence IDs; exact brand values are expressly not sampled or adopted. One point withheld because no measured color/type metrics or interactive-state observation supports more granular visual specification."},{"category":"brandSafety","evidence":"art-direction.json: E10-E11, offLimits, portfolioTranslation.avoid, compliance","deduction":"The package forbids logos, wordmarks, slogans, official media, screenshots, icons, diagrams, production CSS, and SamsungOne. It specifies self-authored diagrams/metrics and explicitly rejects console and carousel imitation; no trademark-confusion or restricted-asset instruction was found."},{"category":"themeHandoff","evidence":"art-direction.json: portfolioTranslation.themeCandidates, pageTypeDirections, use, avoid; portfolio-system/THEME_CONTRACT.md","deduction":"All required theme-contract variables have values and traceable metadata, and cover/architecture/result/closing guidance is present. The package preserves facts, semantic DOM, page order, and common core; it approves research handoff only, not a final theme or rendered portfolio."},{"category":"uncertainty","evidence":"art-direction.json: researchCoverage.limitations, uncertainties[0-2]; sources.md: Conflicts, limits and weighting","deduction":"Unobserved exact palette, font metrics, image crops, interaction behavior, SCP console access, and SamsungOne rights are explicit with impact and resolution paths. One point withheld because supplied rendered-capture provenance is documented in the ledger but no durable local capture metadata/artifact path is available for reinspection."}]}
